{
  "name": "Modell Viewer (STL)",
  "description": "3D-Ansicht für STL-Dateien",
  "url": "https://cbcmlt.github.io/modell-viewer/",
  "repo": "cbcmlt/modell-viewer",
  "category": "Analyse",
  "tech": "javascript",
  "roles": ["planer", "entwickler"],
  "dataClassification": "C1",
  "maintainer": "chrisborgc@gmail.com",
  "iconEmoji": "🧊"
}
