{
  "name": "Demo Python",
  "description": "Projekt Übersicht Demo — Python (Streamlit, serverbasiert)",
  "url": "https://demo-python.streamlit.app/",
  "repo": "cbcmlt/demo-python",
  "tech": "python",
  "hosting": "server",
  "category": "Prototypen",
  "roles": ["entwickler"],
  "version": "1.0.0",
  "dataClassification": "C1",
  "maintainer": "Dev-PuD@max-boegl.de",
  "iconEmoji": "🐍"
}
