{
  "name": "Tisch Konfigurator",
  "description": "Konfiguration von Tischelementen",
  "url": "https://cbcmlt.github.io/tisch-konfigurator/",
  "repo": "cbcmlt/tisch-konfigurator",
  "category": "Konfiguration",
  "tech": "javascript",
  "hosting": "static",
  "roles": ["planer", "entwickler"],
  "dataClassification": "C1",
  "maintainer": "chrisborgc@gmail.com",
  "iconEmoji": "🪑"
}
